{
  "$schema": "http://json-schema.org/draft-07/schema#",
  "$id": "https://klartex.se/schemas/balansrakning/v0.1",
  "title": "Balansräkning",
  "description": "Balance sheet with assets and liabilities+equity sections",
  "type": "object",
  "required": ["title", "period", "rubrik_ar1", "rubrik_ar2", "tillgangar", "skulder_eget_kapital"],
  "properties": {
    "page_template": {
      "description": "Sidmall: namn eller objekt med overrides (sidnummer, typsnitt, sidfot).",
      "default": "formal",
      "oneOf": [
        { "type": "string", "enum": ["formal", "clean", "none"], "description": "Sidmallens namn" },
        {
          "type": "object",
          "required": ["name"],
          "additionalProperties": false,
          "properties": {
            "name": { "type": "string", "enum": ["formal", "clean", "none"], "description": "Sidmallens namn" },
            "page_numbers": { "type": "boolean", "description": "Visa sidnummer i sidfoten" },
            "first_page_header": { "type": "boolean", "description": "Visa sidhuvud på första sidan" },
            "font": { "type": "string", "description": "Dokumentets typsnitt (fontspec-namn, t.ex. 'Futura'). Måste finnas installerat där renderingen sker." },
            "header_font": { "type": "string", "description": "Typsnitt för sidhuvud och sidfot. Default: samma som font." },
            "diff_style": { "type": "string", "enum": ["color", "underline"], "default": "color", "description": "Hur tillagd text markeras: \"color\" (grön text, default) eller \"underline\" (grön understruken \u2014 konventionen i \u00e4ndringsdokument, och den signal som \u00f6verlever svartvit utskrift). Struken text \u00e4r \u00f6verstruken i b\u00e5da fallen." },
            "footer": {
              "type": "object",
              "additionalProperties": false,
              "description": "Sidfot på varje sida med företags-, kontakt- och betalningsuppgifter. För fakturor hör betalningsuppgifterna hemma här — fakturadatats egna bankgiro/plusgiro/iban/bic-fält är bara en fallback och undertrycks när sidfoten har betalningsuppgifter.",
              "properties": {
                "company": { "type": "string", "description": "Företagsnamn" },
                "address": { "oneOf": [{ "type": "string" }, { "type": "array", "items": { "type": "string" } }], "description": "Postadress som array med en rad per element, t.ex. ['Storgatan 1', '123 45 Stad'] — radbryts som en postadress. En sträng renderas som en enda rad." },
                "seat": { "type": "string", "description": "Styrelsens säte, t.ex. 'Malmö'" },
                "org_number": { "type": "string", "description": "Organisationsnummer" },
                "vat_number": { "type": "string", "description": "Momsregistreringsnummer (SExxxxxxxxxx01)" },
                "f_tax": { "type": "boolean", "description": "true visar raden 'Godkänd för F-skatt'" },
                "phone": { "type": "string", "description": "Telefon" },
                "email": { "type": "string", "description": "E-post" },
                "web": { "type": "string", "description": "Webbplats" },
                "bankgiro": { "type": "string" },
                "plusgiro": { "type": "string" },
                "iban": { "type": "string" },
                "bic": { "type": "string" }
              }
            }
          }
        }
      ]
    },
    "title": {
      "type": "string",
      "description": "Document title (e.g. 'Balansräkning')"
    },
    "period": {
      "type": "string",
      "description": "Accounting period (e.g. 'per 2025-12-31')"
    },
    "rubrik_ar1": {
      "type": "string",
      "description": "Column header for year 1 (e.g. '2025')"
    },
    "rubrik_ar2": {
      "type": "string",
      "description": "Column header for year 2 (e.g. '2024')"
    },
    "tillgangar": {
      "type": "object",
      "description": "Assets section",
      "required": ["grupper"],
      "additionalProperties": false,
      "properties": {
        "grupper": {
          "type": "array",
          "items": { "$ref": "#/definitions/grupp" },
          "minItems": 1
        },
        "resultat": { "$ref": "#/definitions/resultatrad" }
      }
    },
    "skulder_eget_kapital": {
      "type": "object",
      "description": "Liabilities and equity section",
      "required": ["grupper"],
      "additionalProperties": false,
      "properties": {
        "grupper": {
          "type": "array",
          "items": { "$ref": "#/definitions/grupp" },
          "minItems": 1
        },
        "resultat": { "$ref": "#/definitions/resultatrad" }
      }
    },
    "noter": {
      "type": "array",
      "description": "Optional numbered notes",
      "items": {
        "type": "object",
        "required": ["notnr", "text"],
        "additionalProperties": false,
        "properties": {
          "notnr": { "type": "integer" },
          "text": { "type": "string" }
        }
      },
      "minItems": 1
    }
  },
  "definitions": {
    "grupp": {
      "type": "object",
      "required": ["rubrik", "poster", "summa"],
      "additionalProperties": false,
      "properties": {
        "rubrik": { "type": "string" },
        "poster": {
          "type": "array",
          "items": {
            "type": "object",
            "required": ["post", "belopp_ar1", "belopp_ar2"],
            "additionalProperties": false,
            "properties": {
              "post": { "type": "string" },
              "belopp_ar1": { "type": "number" },
              "belopp_ar2": { "type": "number" },
              "notref": { "type": "integer" }
            }
          },
          "minItems": 1
        },
        "summa": { "$ref": "#/definitions/resultatrad" }
      }
    },
    "resultatrad": {
      "type": "object",
      "required": ["label", "belopp_ar1", "belopp_ar2"],
      "additionalProperties": false,
      "properties": {
        "label": { "type": "string" },
        "belopp_ar1": { "type": "number" },
        "belopp_ar2": { "type": "number" }
      }
    }
  }
}
